{
    "$schema": "http://json-schema.org/draft-07/schema#",
    "$comment": "Generated by: https://github.com/friflo/Friflo.Json.Fliox/tree/main/Json/Fliox/Schema",
    "$ref": "#/definitions/EntityRefs",
    "definitions": {
        "EntityRefs": {
            "type": "object",
            "properties": {
                "id":              { "type": "string" },
                "guidEntity":      { "$ref": "./Standard.json#/definitions/Guid", "rel": "guidEntities" },
                "guidNullEntity":  { "oneOf": [{"type": "null"}, { "$ref": "./Standard.json#/definitions/Guid" }], "rel": "guidEntities" },
                "intEntity":       { "$ref": "./Standard.json#/definitions/int32", "rel": "intEntities" },
                "intNullEntity":   { "oneOf": [{"type": "null"}, { "$ref": "./Standard.json#/definitions/int32" }], "rel": "intEntities" },
                "intNullEntity2":  { "oneOf": [{"type": "null"}, { "$ref": "./Standard.json#/definitions/int32" }], "rel": "intEntities" },
                "longEntity":      { "$ref": "./Standard.json#/definitions/int64", "rel": "longEntities" },
                "longNullEntity":  { "oneOf": [{"type": "null"}, { "$ref": "./Standard.json#/definitions/int64" }], "rel": "longEntities" },
                "shortEntity":     { "$ref": "./Standard.json#/definitions/int16", "rel": "shortEntities" },
                "shortNullEntity": { "oneOf": [{"type": "null"}, { "$ref": "./Standard.json#/definitions/int16" }], "rel": "shortEntities" },
                "byteEntity":      { "$ref": "./Standard.json#/definitions/uint8", "rel": "byteEntities" },
                "byteNullEntity":  { "oneOf": [{"type": "null"}, { "$ref": "./Standard.json#/definitions/uint8" }], "rel": "byteEntities" },
                "customIdEntity":  { "type": ["string", "null"], "rel": "customIdEntities" },
                "intEntities":     { "type": ["array", "null"], "items": { "$ref": "./Standard.json#/definitions/int32" }, "rel": "intEntities" },
                "intNullEntities": { "type": ["array", "null"], "items": { "oneOf": [{ "type": "null"}, { "$ref": "./Standard.json#/definitions/int32" }]}, "rel": "intEntities" }
            },
            "required": [
                "id",
                "guidEntity",
                "intEntity",
                "longEntity",
                "shortEntity",
                "byteEntity"
            ],
            "additionalProperties": false
        }
    }
}

