{
    "id": "entity-ref-1",
    "guidEntity": "11111111-1111-1111-1111-111111111111",
    "guidNullEntity": "22222222-2222-2222-2222-222222222222",
    "intEntity": 1234567890,
    "intNullEntity": null,
    "intNullEntity2": 1222222222,
    "longEntity": 1234567890123456789,
    "longNullEntity": null,
    "shortEntity": 12345,
    "shortNullEntity": null,
    "byteEntity": 123,
    "byteNullEntity": null,
    "customIdEntity": "abc",
    "intEntities": [
        1234567890
    ],
    "intNullEntities": [
        1234567890,
        null
    ]
}